{
  "schema_version": "0.5.0",
  "event_id": "APR-TEST-001",
  "artifact_id": "ART-TEST-001",
  "artifact_version": "1.0.0",
  "artifact_sha256": "0000000000000000000000000000000000000000000000000000000000000000",
  "decision": "approved",
  "actor_type": "human",
  "actor_id": "test-reviewer",
  "authority": "Release fixture approver",
  "recorded_at": "2026-08-09T20:00:00Z",
  "scope": "test_fixture",
  "previous_state": "revised_draft",
  "resulting_state": "approved",
  "reason": "Contract validation fixture"
}
